<!ELEMENT branches (branch+)>
<!ELEMENT branch (address, phone, hours, maplink)>
<!ELEMENT address (#PCDATA)>
<!ELEMENT phone (#PCDATA)>
<!ELEMENT hours (#PCDATA)>
<!ELEMENT maplink (#PCDATA)>