<?xml version="1.0" encoding="UTF-8"?>
<!DOCTYPE branches SYSTEM "branches.dtd">
<branches>
    <branch>
        <address>76 Devonshire St, Surry Hills NSW</address>
        <phone>02 9211 1234</phone>
        <hours>Mon - Fri: 6:00 to 14:30, Sat-Sun: 7:00 to 15:00</hours>
        <maplink>https://maps.google.com/?q=76+Devonshire+St,+Surry+Hills,+NSW</maplink>
    </branch>
    <branch>
        <address>451 Pitt St, Haymarket Sydney, NSW</address>
        <phone>02 9262 5678</phone>
        <hours>Mon - Fri: 6:00 to 16:00, Sat-Sun: 7:00 to 15:00</hours>
        <maplink>https://maps.google.com/?q=451+Pitt+St,+Haymarket,+Sydney,+NSW</maplink>
    </branch>
    <branch>
        <address>31 Alfred Street, Circular Quay, NSW</address>
        <phone>02 8971 9101</phone>
        <hours>Mon - Fri: 6:00 to 16:00, Sat-Sun: 7:00 to 15:00</hours>
        <maplink>https://maps.google.com/?q=31+Alfred+Street,+Circular+Quay,+NSW</maplink>
    </branch>
</branches>